{
  "task_id": "example_planning_001",
  "agent_model": "gpt-5.1",
  "task_category": "planning",
  "metadata": {
    "min_required_source": 3,
    "fragmentation_depth": 2,
    "indirection_depth": 2,
    "noise_level": 0
  },
  "canonical_answer": {
    "meeting_slots": [
      {
        "date": "2025-12-02",
        "slot": "14:00-14:45"
      },
      {
        "date": "2025-12-03",
        "slot": "13:00-13:45"
      }
    ]
  },
  "agent_result": {
    "task_id": "example_planning_001",
    "final_answer": "The following times work for all three participants (Alice, Bob, and Carol) next week:\n\n- Tuesday, 2025-12-02\n  - 13:00\u201313:30 (within 13:00\u201313:45)\n  - 14:00\u201314:30 (within 14:00\u201314:45)\n  - 15:00\u201315:30 (within 15:00\u201315:45)\n  - 16:00\u201316:30 (within 16:00\u201316:45)\n\n- Wednesday, 2025-12-03\n  - 13:00\u201313:30 (within 13:00\u201313:45)\n\nIf you\u2019d like a single recommended slot, I suggest:\n- Tuesday, 2025-12-02, 14:00\u201314:30",
    "rationale": "- Tools used:\n  - `contacts_search_by_name` to resolve the email addresses for \u201cAlice\u201d, \u201cBob\u201d, and \u201cCarol\u201d.\n  - `calendar_query_freebusy` to find common free time slots for those three email addresses next week.\n- What I found:\n  - `contacts_search_by_name` returned:\n    - Alice \u2192 alice@example.com\n    - Bob \u2192 bob@example.com\n    - Carol \u2192 carol@example.com\n  - Using these emails, `calendar_query_freebusy` for 2025-12-01 to 2025-12-07 (the week after the current date 2025-11-24) with a minimum duration of 30 minutes returned common free slots:\n    - 2025-12-02: 13:00\u201313:45, 14:00\u201314:45, 15:00\u201315:45, 16:00\u201316:45\n    - 2025-12-03: 13:00\u201313:45\n- How I applied constraints:\n  - You asked for a time \u201cnext week\u201d and a meeting that works for all three people.\n  - I interpreted \u201cnext week\u201d relative to 2025-11-24 as the week starting Monday, 2025-12-01 through Sunday, 2025-12-07.\n  - I requested at least 30 minutes of common availability; each returned slot is at least 45 minutes, so any 30-minute meeting fits inside.\n- Why I selected the final answer:\n  - I listed all overlapping windows where all three are available.\n  - I recommended Tuesday 2025-12-02, 14:00\u201314:30 as a balanced option (midday, not too early or late, and with multiple adjacent free slots in case you need to extend or move it).",
    "tool_calls": [
      {
        "step": 1,
        "tool_name": "contacts_search_by_name",
        "arguments": {
          "name": "Alice",
          "limit": 5
        },
        "result": {
          "contacts": [
            {
              "name": "Alice",
              "email": "alice@example.com"
            }
          ]
        }
      },
      {
        "step": 2,
        "tool_name": "contacts_search_by_name",
        "arguments": {
          "name": "Bob",
          "limit": 5
        },
        "result": {
          "contacts": [
            {
              "name": "Bob",
              "email": "bob@example.com"
            }
          ]
        }
      },
      {
        "step": 3,
        "tool_name": "contacts_search_by_name",
        "arguments": {
          "name": "Carol",
          "limit": 5
        },
        "result": {
          "contacts": [
            {
              "name": "Carol",
              "email": "carol@example.com"
            }
          ]
        }
      },
      {
        "step": 4,
        "tool_name": "calendar_query_freebusy",
        "arguments": {
          "email_addresses": [
            "alice@example.com",
            "bob@example.com",
            "carol@example.com"
          ],
          "start_date": "2025-12-01",
          "end_date": "2025-12-07",
          "duration_minutes": 30
        },
        "result": {
          "time_slots": [
            {
              "date": "2025-12-02",
              "slot": "14:00-14:45",
              "participants": [
                "alice@example.com",
                "bob@example.com",
                "carol@example.com"
              ]
            },
            {
              "date": "2025-12-02",
              "slot": "13:00-13:45",
              "participants": [
                "alice@example.com",
                "bob@example.com",
                "carol@example.com"
              ]
            },
            {
              "date": "2025-12-02",
              "slot": "15:00-15:45",
              "participants": [
                "alice@example.com",
                "bob@example.com",
                "carol@example.com"
              ]
            },
            {
              "date": "2025-12-02",
              "slot": "16:00-16:45",
              "participants": [
                "alice@example.com",
                "bob@example.com",
                "carol@example.com"
              ]
            },
            {
              "date": "2025-12-03",
              "slot": "13:00-13:45",
              "participants": [
                "alice@example.com",
                "bob@example.com",
                "carol@example.com"
              ]
            }
          ]
        }
      }
    ]
  },
  "validation_errors": [],
  "scores": {
    "answer_requirements_satisfaction": 0.6
  }
}